title|publish_date|text|url
Here are Security Guidelines for the Floodlights 7’s at Kyandondo Rugby club.|07/09/2016|"Acheive your dreams with Stanbic Bank. Visit thier website todayMore here.

By Staff Writer

The betting industry is now known to almost every sport’s enthusiast. And it is more often seen as an additional source of income. So, bet Uganda online with 1xBet will help to earn money in the upcoming competitions of the Spanish La Liga, which intrigues many football fans today. Simply create an account on the platform and select the most interesting event.

To date, the Spanish championship is an uncertain situation. Two classic rivals – «Real Madrid» and «Barcelona» – are actively fighting for “gold”, with an equal number of points throughout the season. Now a lot depends on the results of the remaining matches, that’s why because of any loss of points a team may miss its chance for the championship.

Now the favorites are considered to be the “whites”, as their head coach made a special emphasis on the formation of the correct lineup and style of play. Thus, the team of «Real Madrid» are characterized by the following reinforcements:

the addition of the very strong striker E. Hazard to the team;

team game improvement;

game motivation.

In addition, Lionel Messi now shows bad results during the games – unconventional ball control and lack of dominance on the playing field.

With the use of betting online with company 1xBet in Uganda you have the opportunity to make quality forecasts for the upcoming matches of both teams.

And for all the users it is also possible to test certified casino slots on 1xbet.com.ug. They will give you unforgettable emotions and bring you additional income into the game balance.

Make your bets on NHL 20 cyber league online on 1xBet daily

Cyber sports has been developing in bookmakers’ companies for six months now. Many clients have paid attention to it because of its advantages. For example, make your bets on NHL 20 cyber league online on 1xBet and increase daily the amount of money on the game balance. For each event here, there are many options for bets that will successfully lead to an increase of your account balance. Virtual hockey league will be as spectacular as the real one. The best Cyber sportsmen in the world will showcase their skills so it will be possible to get big winnings.

In order to add even more emotion, it is possible to make the bets on NHL 20 Cyber league online in 1xBet and watch the online broadcasts of each game. This will also allow to watch the game’s progress and make the most accurate forecasts. You can always keep abreast of all events.



Loading...

(Visited 1 time, 1 visit today)

Share

WhatsApp

Tweet

"|https://bigeye.ug/security-guidelines-floodlights-7s-kyandondo-rugby-club/
Entries flood in for All Africa Music Awards|16/07/2016|"Going by the enthusiastic response of African music artistes, music professionals and journalists who have flooded the AFRIMA website with entries from across the continent and from Africans in the Diaspora for the 2016 All Africa Music Awards, AFRIMA tagged “AFRIMA 3.0”, the International Committee of AFRIMA is appealing to other music professionals yet to submit their works that there will be no extension after the deadline for submission on July 30, 2016.

Explaining further, Project Director, Kemi Ashefon, said: “I must say we are impressed by the level of participation by African artistes, on the continent and in the Diaspora, in the on-going AFRIMA 3.0 entries submission process so far. This is an encouraging success marker for us considering the fact that we have surpassed the 1500 mark before the close of entries in two weeks’ time.”

“In the spirit of our FACE IT value of Fairness, Accountability, Creativity, Excellence, Integrity and Transparency, we hope the last 2 weeks to the deadline will give everyone a chance to get involved in AFRIMA.” She concluded.

In partnership with the African Union Commission, AUC, The All Africa Music Awards, AFRIMA, is a music and cultural initiative developed to celebrate, reward and showcase the rich musical heritage of Africa, stimulate conversations among Africans and between Africa and the rest of the globe about the great potentials and values of the African culture and artistic legacy for the purpose of creating jobs, reducing poverty, calling attention of world leaders to Africa and promoting the positive image of Africa to the world.

Speaking further on what to expect after the close of entries in July 30, The President and Executive Producer, AFRIMA, Mike Dada said “We would not want to distort the calendar for this year’s edition. Sticking to the deadline will enable an early screening on the list of entries submitted for the adjudication process and nominees’ announcement.”

The 13-person AFRIMA jury which represents the five regions of Africa and the Diaspora will be arriving from August 16 to 23 for the crucial responsibility of screening, categorising, assessing and selecting nominees from the body of works submitted for award consideration. Concluding the adjudication process, on August 22 will be the World Media Announcement of the continental Awards."|https://bigeye.ug/entries-flood-in-for-all-africa-music-awards/
Miss Zimbabwe stripped of title after naked photos of her flood WhatsApp|12/06/2015|"The current Miss Zimbabwe has been stripped of her title on the grounds of ‘immoral behaviour’ after naked photographs of her appeared on the instant messaging service WhatsApp.

Emily Kachote, 25, broke rules that insist beauty queens must never pose nude, the pageant board said in a statement amid claims the model’s former lover deliberately leaked the images.

In a bizarre twist, Miss Kachote’s predecessor Thabiso Phiri, 22, was also stripped of the Miss Zimbabwe title – which automatically enters the winner into the Miss World competition – after nude photographs she had sent to her boyfriend were leaked and went viral.

In a statement, the Miss Zimbabwe pageant board said Miss Kachote ‘violated the rules and regulations governing the pageant’, referring to nude images of that appeared on Whatsapp, according to a local tabloid newspaper.

‘Winners of the Miss World Zimbabwe beauty pageant whether a title holder or runner-up must not have posed nude professionally or socially in all forms of media,’ the organisers said.

‘Being in a relationship, sexual advances to anyone and any behaviour categorised as immoral by the Miss Zimbabwe Trust is grounds for instant disqualification and dethronement,’ they added.

When rumours of the scandal broke last month, Miss Kachote was quoted by New Zimbabwe as saying: ‘I was hoping the pictures would have been deleted by now since it happened a long time ago and I last spoke to the guy a year ago and I no longer have anything to do with [him]…’

‘I have always suspected that those pictures would circulate, but it happened a long time ago, and I believe my past does not determine where I am going,’ she reportedly added.

According to News 24, the disqualification will be welcomed in some quarters by Miss Zimbabwe watchers who branded the model ‘too ugly’ to hold the title.

Miss Kachote, a psychology graduate turned financial advisor, was crowned Miss World Zimbabwe in April, beating 15 other models.

The organisers of the contest said Kachote’s pictures were leaked shortly after she confessed to having once posed nude.

The board said Kachote will be replaced by runner-up Grace Mutambu, who will represent Zimbabwe at the Miss World pageant in Sanya, China in December.

Last year’s Miss Zimbabwe Miss Phiri was also caught up in a nude photo scandal and was forced to resign.

And in 2003 another Miss Zimbabwe, Linda Van Beek, was also forced to step down ahead of scehdule when she fell pregnant.

Miss Zimbabwe rules stipulate that entrants must not be expecting at the time of their election, nor can they fall pregnant during their ‘reign’.

Source: Daily Mail"|https://bigeye.ug/miss-zimbabwe-stripped-of-title-after-naked-photos-of-her-flood-whatsapp/
Nicole Scherzinger in tears as ex Lewis Hamilton continues to party.|25/02/2015|"Nicole Scherzinger has been left in “floods of tears” after seeing her ex Lewis Hamilton partying with other women, it has been claimed.

The singer split from her F1 ace partner last month, but is said to be upset after seeing him appear to move on quickly.

Lewis was seen out with a mystery blonde just a week later in New York , and has since posed with supermodel Naomi Campbell – who he was romantically linked with back in 2007.

“Nicole has been in pieces about the split,” a source told New! magazine. “Lewis promised her he’d respect her and not go rushing into another relationship or even hang out with other girls.

“So she was devastated when she saw him partying in New York. She’s been in floods of tears most of the time.”

The star even reportedly sent a text to her ex, asking him to stop. But according to New! Lewis simply replied that he was “letting his hair down”, and they have been in contact ever since.

Lewis was previously romantically linked to Naomi Campbell in 2007, shortly after he met Nicole, but they always insisted they were just friends.

In fact, he even captioned his recent snap: “Selfie with my big sis.”

The supermodel has also been spotted out with them as a couple during their relationship.

The source added: “Lewis feels he should be able to have friendships with other women without feeling he constantly has to justify himself to her.”

A rep for Lewis confirmed to New! that the F1 star is “definitely not romantically linked to anyone”.

Source: Mirror"|https://bigeye.ug/nicole-scherzinger-floods-tears-ex-lewis-hamilton-continues-party-women/
