title|publish_date|text|url
Kasese floods Archives|01/06/2020|"The Forum for Democratic Change has launched an appeal called RESTORING HOPE AND LIVES to aid the People of Kasese now living in desperate conditions in camps following the recent flooding.

On the 25th of March this year, about 125000 people were left displaced and others lost their lives after rivers including Nyamughasana, Mubuku, Lhubiriha and Nyamwamba burst their banks causing heavy flooding.

The flooding also left a number of bridges connecting villages in Kilembe, Karambi, Bugoye, Maliba, Mpondwe Lhubiriha Town Council, Karusandara, Kyarumba, Ibanda, Kyanya Town Council and the three divisions of Kasese Municipality destroyed.

Since then, government has set up a total of 35 camps for the displaced families as it continues to search for the missing remains of the deceased.

FDC, President Patrick Oboi Amuriat is now calling upon any Uganda to donate food, clothing and any financial assistance to the said cause to help the affected people in Kasese and Bundibugyo.

The party has however criticized the ruling government of failing to prepare for such disasters that FDC says are predictable."|https://capitalradio.co.ug/tag/kasese-floods/
New program to help Kasese flood victims launched|01/06/2020|"New program to help Kasese flood victims launched

The Forum for Democratic Change has launched an appeal called RESTORING HOPE AND LIVES to aid the People of Kasese now living in desperate conditions in camps following the recent flooding.

On the 25th of March this year, about 125000 people were left displaced and others lost their lives after rivers including Nyamughasana, Mubuku, Lhubiriha and Nyamwamba burst their banks causing heavy flooding.

The flooding also left a number of bridges connecting villages in Kilembe, Karambi, Bugoye, Maliba, Mpondwe Lhubiriha Town Council, Karusandara, Kyarumba, Ibanda, Kyanya Town Council and the three divisions of Kasese Municipality destroyed.

Since then, government has set up a total of 35 camps for the displaced families as it continues to search for the missing remains of the deceased.

FDC, President Patrick Oboi Amuriat is now calling upon any Uganda to donate food, clothing and any financial assistance to the said cause to help the affected people in Kasese and Bundibugyo.

The party has however criticized the ruling government of failing to prepare for such disasters that FDC says are predictable."|https://capitalradio.co.ug/new-program-help-kasese-flood-victims-launched/
Red Cross gives relief items to flood victims in the Elgon region|30/08/2018|"Red Cross gives relief items to flood victims in the Elgon region

By Kidandi Moses

Government has embarked on the second phase of distributing relief supplies to several house holds affected by disasters in eastern Uganda. The distribution exercise being undertaken by the Uganda Red Cross is focusing on flooding victims in the Elgon region, Kumi and Bukedea.

Last week hundreds of families in katakwi benefited from relief items like basins, shelter, blankets among other none food items. The affected locals have come out to say that they appreciate the Red Cross efforts but still require food as it is difficult to farm in flooded conditions."|https://capitalradio.co.ug/red-cross-gives-relief-items-flood-victims-elgon-region/
UNRA warns public against using flooded roads|13/05/2020|"UNRA warns public against using flooded roads

By Deo Wasswa

Technical team from Uganda National Roads Authority is assessing and monitoring a section of Kasese – Kilembe road that was cut-off by heavy floods last week to restore the road back to traffic.

Allan Sempebwa Media Manager at UNRA says right now waters are still flowing at a very rapid speed. He adds that as as soon as the situation comes to normal the works will commence.

He also says apart from water, the section is covered by so many of rocks that were deposited by River Nyamwaba from mountains.

Sempebwa notes that other technical teams are also in parts of the country especially in eastern to ensure all areas that have been cut off by heavy rains can be restored as soon as possible.

Over the weekend, all roads in Kween district were affected by heavy rains and the works to desilt Chespikunya-Girik road have also commenced according to UNRA.

UNRA however has cautioned the public to avoid using roads that are flooding for safety purposes."|https://capitalradio.co.ug/unra-warns-public-using-flooded-roads/
14 FLOOD PRONE AREAS IN KAMPALA OUTLINED|19/04/2016|"14 FLOOD PRONE AREAS IN KAMPALA OUTLINED

The police fire and rescue directorate has outlined 14 flood prone areas in Kampala metropolitan to help coordinate y response in case of any emergency during the rainy season.

The director of fire and rescue services Joseph Mugisa says has listed Bwaise, Kyambogo, Nalukolongo, Kamwokya Clock tower and Namasuba a long Entebbe road among the most flood prone areas during this rainy season.

He explained that much as the rescue police are on alert to respond to any emergency, motorists and pedestrians should not drive through floods while residents should avoid walking in the running water to avoid be washed away."|https://capitalradio.co.ug/14-flood-prone-areas-in-kampala-outlined/
