title|publish_date|text|url
Guinness unveils new look at floodlights 7s series finale|03/09/2018|"Acheive your dreams with Stanbic Bank. Visit thier website todayMore here.

By Staff Writer

If you live in a small space, everything has the potential to make a massive difference. And that’s the key idea behind this article. In this article, we’ll teach you tips and tricks that can help you make your small room look bigger by the application of just a few clever tips and tricks. Unfortunately, the small rooms can make the space look uncomfortable and confining. However, there are a few design concepts, which can fool the eye and make any space look more spacious than it already is. Furniture arrangements, color techniques, and smart lighting are just a few of the many topics that will be covered in this post. Hopefully, these ideas will be inspiring for you.

Use clever contrasts and light areas

It is a well-known fact that light colors have the potential to make space look brighter and bigger. Bright walls and light together act as reflective and make space feel more airy and open. This helps maximize the effect, which is created with the help of natural light. On the other hand, the dark colors absorb the light and make the room look smaller. To achieve an optimum effect, you should opt for softer hues like green, blue, and off-white. Also, remember that a brighter room will look more inviting and certainly bigger. Anusha, a hobbyist home decorator, who is a full-time assignment expert at TFTH,says that she just painted the moldings and the wall trims (blue) in a color lighter than the color of the walls (green), and now the room looks bigger because the wall seems farther apart from each other.

Lighting is your key to opening up any space

Rihanna, a college student who availed of statistics homework help by TAE, currently lives in a small rented apartment. She said she has added a bunch of lighting fixtures in her room, and that gives an illusion of it being bigger than normal. If you do not want to invest in lighting fixtures, let the natural light inside the room. You’ll be amazed at the kind of difference lighting can make for your room. When you have adequate access to the natural light, allowing it into the home via large windows will work as a connection between the room and the outdoors, thereby making space look bigger. You can either get sheer window covering or completely pull them back, to ensure that more light comes in. In case the view outside is not very pleasant, you can add some flowers or plants near the window. You can even use some lamps to brighten up space.

Cut out the clutter

You must keep your room organized and tidy. Harry, who is a homework help assistant with EssayWriter4U,says that he has a stack of books for his reference, which he rarely ever uses in his room, and that occupies a lot of space. He recently got rid of all of these books, and that made his room look more organized and tidy. Trust us when we say this, nothing else makes the room look more cramped and cluttered than having too much stuff. When things are arranged neatly, space looks more open and orderly. Always remember, a cluttered room is equivalent to a smaller room. Also, do not just cover all the walls with a lot of pictures and photographs. If you want the room to look bigger, just a large painting works better than multiple smaller paintings. If a lot is happening in the room, it can make it look crowded and busy. Now, when you are decorating a small room, try to create one focal point, one feature, or area that will bag all the attention. For instance, if it is the dining room, then this area will be the dining table. Now, you have to arrange the furniture in a manner that the focus is on this area. So, naturally, you have to ensure that the décor around is minimalist. Furthermore, you should try to keep the floor as clear as possible. This is certainly the most important tip to make the room look spacious. You can get rid of all the larger rugs to give an illusion of wider floor space.

Add mirrors in the room

Mirrors give an illusion of a bigger room. So, for the adequate effect, you can pick a focal point, and then position your mirror towards it. This will give an illusion of depth. Furthermore, the mirror reflects the artificial as well as the natural light. As a result, the room looks lighter and brighter during the day and the night. Mirrors tend to bounce the light into the room, and thus, make it look larger. Ayesha, who is a work from the home employee with TrumpLearning,says that since she spends a major part of her day in her room, she has placed the mirror right near the window, as it reflects the light of the sun and makes the room look more airy and fresh. You can also add a mirrored cabinet that’d make space look larger.

Loading...

(Visited 1 time, 1 visit today)

Share

WhatsApp

Tweet

"|https://bigeye.ug/guinness-unveils-new-look-at-floodlights-7s-series-finale/
MTN Uganda Supports Kasese Floods Victims With Non-Food Start-up kits|11/05/2020|"Acheive your dreams with Stanbic Bank. Visit thier website todayMore here.

By Staff Writer

If you live in a small space, everything has the potential to make a massive difference. And that’s the key idea behind this article. In this article, we’ll teach you tips and tricks that can help you make your small room look bigger by the application of just a few clever tips and tricks. Unfortunately, the small rooms can make the space look uncomfortable and confining. However, there are a few design concepts, which can fool the eye and make any space look more spacious than it already is. Furniture arrangements, color techniques, and smart lighting are just a few of the many topics that will be covered in this post. Hopefully, these ideas will be inspiring for you.

Use clever contrasts and light areas

It is a well-known fact that light colors have the potential to make space look brighter and bigger. Bright walls and light together act as reflective and make space feel more airy and open. This helps maximize the effect, which is created with the help of natural light. On the other hand, the dark colors absorb the light and make the room look smaller. To achieve an optimum effect, you should opt for softer hues like green, blue, and off-white. Also, remember that a brighter room will look more inviting and certainly bigger. Anusha, a hobbyist home decorator, who is a full-time assignment expert at TFTH,says that she just painted the moldings and the wall trims (blue) in a color lighter than the color of the walls (green), and now the room looks bigger because the wall seems farther apart from each other.

Lighting is your key to opening up any space

Rihanna, a college student who availed of statistics homework help by TAE, currently lives in a small rented apartment. She said she has added a bunch of lighting fixtures in her room, and that gives an illusion of it being bigger than normal. If you do not want to invest in lighting fixtures, let the natural light inside the room. You’ll be amazed at the kind of difference lighting can make for your room. When you have adequate access to the natural light, allowing it into the home via large windows will work as a connection between the room and the outdoors, thereby making space look bigger. You can either get sheer window covering or completely pull them back, to ensure that more light comes in. In case the view outside is not very pleasant, you can add some flowers or plants near the window. You can even use some lamps to brighten up space.

Cut out the clutter

You must keep your room organized and tidy. Harry, who is a homework help assistant with EssayWriter4U,says that he has a stack of books for his reference, which he rarely ever uses in his room, and that occupies a lot of space. He recently got rid of all of these books, and that made his room look more organized and tidy. Trust us when we say this, nothing else makes the room look more cramped and cluttered than having too much stuff. When things are arranged neatly, space looks more open and orderly. Always remember, a cluttered room is equivalent to a smaller room. Also, do not just cover all the walls with a lot of pictures and photographs. If you want the room to look bigger, just a large painting works better than multiple smaller paintings. If a lot is happening in the room, it can make it look crowded and busy. Now, when you are decorating a small room, try to create one focal point, one feature, or area that will bag all the attention. For instance, if it is the dining room, then this area will be the dining table. Now, you have to arrange the furniture in a manner that the focus is on this area. So, naturally, you have to ensure that the décor around is minimalist. Furthermore, you should try to keep the floor as clear as possible. This is certainly the most important tip to make the room look spacious. You can get rid of all the larger rugs to give an illusion of wider floor space.

Add mirrors in the room

Mirrors give an illusion of a bigger room. So, for the adequate effect, you can pick a focal point, and then position your mirror towards it. This will give an illusion of depth. Furthermore, the mirror reflects the artificial as well as the natural light. As a result, the room looks lighter and brighter during the day and the night. Mirrors tend to bounce the light into the room, and thus, make it look larger. Ayesha, who is a work from the home employee with TrumpLearning,says that since she spends a major part of her day in her room, she has placed the mirror right near the window, as it reflects the light of the sun and makes the room look more airy and fresh. You can also add a mirrored cabinet that’d make space look larger.

Loading...

(Visited 1 time, 1 visit today)

Share

WhatsApp

Tweet

"|https://bigeye.ug/mtn-uganda-supports-kasese-floods-victims-with-non-food-start-up-kits/
Photo: Kim Swagga floods White hooker with Dollars in America|10/03/2016|"Acheive your dreams with Stanbic Bank. Visit thier website todayMore here.

By BigEyeUg Team

Legendary singer Jose Chameleone can’t cease his history of blowing-up fights in the music industry.

He has severely been reported reincarnating brawls with different individuals for years now.

Latest on the dark side of his docket is fabled music producer, Diggy Baur (Sabula Boss) who has accused the singer of beating him up and his young brother, a one Akram to injuries.

Producer Diggy Baur

According to the video that Baur has posted today morning on his social media, the scuffle started when his young brother rejected to have Chameleone record a song in the studio.

Baur also reveals how Chameleone’s young brother, Weasel Manizo tried to harmonize the situation that had gone rowdy but Chameleone resented grounding reasons of being a star.

Baur’s injury sustained

He further reveals how he has on various occasions produced songs for the singer at no cost but unfortunately, his sweat and love for Chameleone has been paid with pain.

The stammering-producer also says it has been Chameleone’s routine of coming to his studio, disrespect, and insult and endanger him or his fellow studio colleagues.

Producer Baur’s studio, Sabula Records

The Sabula Records CEO has banned the Lord Mayor to-be from his studio and vowed to school him of respecting other people’s efforts after messing up his life.

Producer Baur is famously named responsible for Jose Chameleone’s songs such as his latest Baliwa and Kiboko featuring Kalifah Aganaga.

Jose Chameleone

Its clearly noticed as a recommendable addiction for Chameleone and his brothers after his brother, Weasel Manizo was also reported last month to have vandalized young producer, Genius Goddy’s studio equipment.

However, Jose Chameleone is yet to issue his remarks regarding the allegations against him.

See video here:

We will keep you posted

Loading...

(Visited 1 time, 1 visit today)

Share

WhatsApp

Tweet

"|https://bigeye.ug/photo-kim-swagga-floods-white-hooker-with-dollars-in-america/
Mbale Girl floods Facebook with nude photos of herself.|03/08/2015|"Acheive your dreams with Stanbic Bank. Visit thier website todayMore here.

By Reporter

His latest one with the Successful Tropical House Cruises To Jamaica (2020 Reggae Lovers Edition) released by international Music Mogul Sean Kontractor and his Music Group is comparable to an athlete winning a gold medal in the Olympics and once again Highlights Uganda as a force to be reckoned with in the industry, this humble man is a true ambassador for Uganda and its talents.

Herbert Skillz has a song on the successful Album with Legend Wayne Wonder and Superstar Jethro Alonestar Sheeran (Ed Sheerans Cousin) The song “In My Arms” was produced from Herbert Skillz Studio here in Uganda “Sound Makers Music”, and the song and album is breaking records and chart topping world wide, already being number 1 for streams on I tunes and Apple Music in many countries, ahead in some charts of the legend Bob Marley and Jamiacan Star Popcaan, and featuring such international stars as Shatta Wale, DaBaby, Beenie Man, Elephant Man, King Tiger, Sizzla Kalonji, Don Yute, Tommy Lee Sparta, Royce 59, to name a few and of course Jethro Alonestar Sheeran and Wayne Wonder both of whom Skillz has worked with for some time, and brought together for the song.

Herbert Skillz wrote the music score for the song “In my Arms” and produced it, whilst Alonestar Sheeran and Wayne Wonder wrote the lyrics and sang the vocals.

The song is an exciting teaser and forerunner of what is come on Herbertskillz and Alonestar’s own Album “Sunshine and Rain” which will be released in a few weeks time. When asked how he achieves such excellence and respect in the international industry, Skillz said “good management and hard work, and working with professional people”, when asked about what else to expect this year, he said, “watch this space, Alonestar and I have some massive tracks to release together yet with some huge features on them, so you wont be disappointed”.

We jokingly asked is this the year you make history again and we see you with a Billboard or Grammy, he laughed and said “perhaps? who knows? Everything is possible.”

Tropical House Cruises to Jamaica Reggae Lovers Edition 2020 is available now from the link below.

https://music.apple.com/us/album/tropical-house-cruises-to-jamaica-reggae-collectors/1516073921

Loading...

(Visited 1 time, 1 visit today)

Share

WhatsApp

Tweet

"|https://bigeye.ug/mbale-girl-floods-facebook-with-nude-photos-of-herself/
Thousands flood Mesach Semakula's Omwana Wa Mutesa concert|26/09/2015|"By BigEyeUg Team

Mesach Semakula’s Omwana Wa Mutesa concert that took place at Hotel Africana last night was well attended.

The concert that saw several musicians in attendance to support the Golden band singer, kicked off at around 7:30pm with a performance from Nsamba Trumpet performing some of the crowds favourites and warming the stage for the big man.

Several other artistes followed with entertaining performances. These included Golden Bands Carol Nantongo, Eddie Lule, Chris Wajadi who will be launching his Muganzi Lwaza album on December 4th,Sir Mathias Walukagga then jumped on stage, Golden Guvnor Grace Sekamatte then shook it for the fans along with Nsamba, Kinene Micheal Lumala, Doreen Mutiibwa, Haji Mubiru Harunah, Bebe Cool, Hilderman, Stecia Mayanja all did their thing to the fans amazement.

At about 10pm, Mesach Semakula, the man of the night made a grand entrance, ‘Abawagizi bange’ is one of his songs that got everyone off their seats into dance mode. He was later joined by the Golden Band commander, Ronald Mayinja, Chris Evans, Abdul Mulasi among others.

After the concert, Mesach praised his fans for the support and pledged to keep producing good music for them. “God is good my brothers and sisters,” he said. “Thank you so much for supporting me ladies and gentlemen. May God bless each one of you. I will keep giving you good music.”

The concert was sponsored by MTN Uganda.

Here are some photos from the concert."|https://bigeye.ug/thousands-flood-mesach-semakulas-omwana-wa-mutesa-concert-photos/
Happy Birthday! Bobi Wine Fans flood Barbie with lovely messages.|07/09/2015|"Acheive your dreams with Stanbic Bank. Visit thier website todayMore here.

By BigEyeUg Team

Sheila seems to be in control of the Uganda’s media at the moment with her one month old ‘Stop cyber bulling in Uganda’ campaign.

After her victory over Urban TV’s Tina Fierce whom she accused of using her ‘Scoop On Scoop’ show to throw malicious insults at her, Sheila has now turned guns at Nation Media’s Isaac Katende aka Kuku Wazabanga (Kasuku).

This follows Kasuku’s remarks on Sheila Gashumba’s ‘Stop Cyber Bullying in Uganda’ while appearing on NBS TV’s ‘Uncut Sabula’ show.

Kasuku

During the interview, Kasuku asserted that Sheila has no moral authority to run such a campaign having also been a culprit of social media bullying when she used her handles to insult, former NTV presenter, Robin Kisti.

Kasuku’s opinion didn’t sound pleasant to Sheila even for a blink of an eye as she immediately set a Facebook live video to drop her response on his claims.

In the video, Gashumba revealed how Kasuku should have been their (Sheila and Gods Plan) target to hunt-down in this campaign because of his continuous malicious criticism to musicians.

Sheila Gashumba

She also says that Kasuku is just being a hypocrite whom she once helped to have his first buffet at Kampala Serena Hotel.

Sheila has also shifted the war to Twitter as she continues to shower the ‘Talk and Talk’ show presenter with unbearable insults of his career.

“Age is just a number it has never meant Intelligence!! Kasuku you should be retired now allowing other young talented youth to have a chance to be on radio and tv than attacking public figures!! You should be on holiday right now!!” tweeted Sheila.

Surely Kasuku seems to have been a valuable item for Gashumba to ruin under this campaign as she has also onboarded boyfriend, Gods Plan in the war.

Gods plan indirectly thumbs Kasuku for having begged him Shs. 50K for transport.

Sheila Gashumba and boyfriend, Gods Plan

He also advises him to first pocket adequate evidence before giving opinions during discussions.

“I remember giving someone 50k outside guvnor for transport. Naye MUJOOGA

My advice to journalist or radio presenters is always investigate before opening your mouth to give an opinion. Your opinion has to be based on facts not because your friend told you his side,” tweeted Gods Plan.

However, Kasuku seems not over taken by the couple’s words as he buries hope of getting any reply from him.

“Afta alot of thought,am not going to get involved in a verbal exchange with Sheila Gashumba or the boyfie.This has become their way of life lately. They can mek all the noise in the world and enjoy retweets but not today… Time will tell. Gudnite,” wrote Kasuku.

The campaign was initiated by Sheila and boyfriend, Gods Plan last month to curb the thrilling social media harassment in Uganda, marking celebrities as the best victims.

Having landed Kasuku, one of the most celebrated critic media personalities in the country on her docket, the public highly anticipates the fresh war to escalate beyond this point.

We will keep you posted.

Loading...

(Visited 1 time, 1 visit today)

Share

WhatsApp

Tweet

"|https://bigeye.ug/happy-birthday-bobi-wine-fans-flood-barbie-with-lovely-messages/
SC Villa – Express clash called off after heavy rains left pitch flooded. [Photo]|30/10/2015|"Acheive your dreams with Stanbic Bank. Visit thier website todayMore here.

By Staff Writer

The betting industry is now known to almost every sport’s enthusiast. And it is more often seen as an additional source of income. So, bet Uganda online with 1xBet will help to earn money in the upcoming competitions of the Spanish La Liga, which intrigues many football fans today. Simply create an account on the platform and select the most interesting event.

To date, the Spanish championship is an uncertain situation. Two classic rivals – «Real Madrid» and «Barcelona» – are actively fighting for “gold”, with an equal number of points throughout the season. Now a lot depends on the results of the remaining matches, that’s why because of any loss of points a team may miss its chance for the championship.

Now the favorites are considered to be the “whites”, as their head coach made a special emphasis on the formation of the correct lineup and style of play. Thus, the team of «Real Madrid» are characterized by the following reinforcements:

the addition of the very strong striker E. Hazard to the team;

team game improvement;

game motivation.

In addition, Lionel Messi now shows bad results during the games – unconventional ball control and lack of dominance on the playing field.

With the use of betting online with company 1xBet in Uganda you have the opportunity to make quality forecasts for the upcoming matches of both teams.

And for all the users it is also possible to test certified casino slots on 1xbet.com.ug. They will give you unforgettable emotions and bring you additional income into the game balance.

Make your bets on NHL 20 cyber league online on 1xBet daily

Cyber sports has been developing in bookmakers’ companies for six months now. Many clients have paid attention to it because of its advantages. For example, make your bets on NHL 20 cyber league online on 1xBet and increase daily the amount of money on the game balance. For each event here, there are many options for bets that will successfully lead to an increase of your account balance. Virtual hockey league will be as spectacular as the real one. The best Cyber sportsmen in the world will showcase their skills so it will be possible to get big winnings.

In order to add even more emotion, it is possible to make the bets on NHL 20 Cyber league online in 1xBet and watch the online broadcasts of each game. This will also allow to watch the game’s progress and make the most accurate forecasts. You can always keep abreast of all events.



Loading...

(Visited 1 time, 1 visit today)

Share

WhatsApp

Tweet

"|https://bigeye.ug/sc-villa-express-clash-called-off-after-heavy-rains-left-pitch-flooded-photo/
Club Beer promises to flood Makerere with booze at the Club Dome|23/09/2016|"Acheive your dreams with Stanbic Bank. Visit thier website todayMore here.

By BigEyeUg Team

Truth be told, true love will feel better than anything else in this world and that is why most people fight to keep it once they find it.

However, singer Brown Shuga’s love story is anything but enjoyable at the moment after silently suffering from depression and frustration for quite some time because of love.

Brown Shugar

On Thursday evening, Brown Shuga could not hide the pain for any longer as she broke down into tears in a viral video that is making rounds on social media, revealing the rationale behind her currently devastating life.

The ‘Sivaawo’ singer claims to be living in denial by hubby, tycoon Charles Olim aka Sipapa.

Brown Shuga reveals that all she adored from Sipapa at the initial stage of her relationship with was love but she was disappointed to the maximum despite her mere request to the tycoon.

She also says her life has been doomed by ever since Sipapa dumped her for another woman, with whom they have even had a child together.

Sipapa and Brown Shugar

Shuga further reveals how her hard work and sweat towards Sipapa career has hit rock bottom after being abandoned to point of lacking even where to sleep.

The singer is also recalled appearing in nasty pictures with injuries she claimed to have sustained from boyfriend, Sipapa’s daily beatings.

The two love birds are believed to have started dating in 2016 but hardly have a child together.

Watch video here;

We will keep you posted.

Loading...

(Visited 1 time, 1 visit today)

Share

WhatsApp

Tweet

"|https://bigeye.ug/club-beer-promises-flood-makerere-booze-tonight-club-dome/
